Business_name,positive,negative,factual,opinion,summary1,summary2,summary3
Aspinwall Grille,65.09609788,34.90390212,64.87795414,35.12204586,- the spinal has a nice neighborhood bar feel to it,"- the chicken wings were cooked nice and crispy, seasoning was right on",- there was even a small mishap with what I considered a great dish.
Arlecchino Ristorante,64.99000186,35.00999814,60.33110119,39.66889881,- the veal chop is one of the best veal chops we've ever had in the city,- the veal chop was perfectly done and tasted scrumptious,- the veal shank looked like something from the Flintstones.
All In Good Taste Productions,64.91163004,35.08836996,56.1790293,43.8209707,- cnn.com's report boot camp challenges you to rate a caterer in the Philadelphia area,- the company refused to do a tasting before we signed a contract,- they were barely responsive-taking 10 days to reply to emails and then rude on the phone.
Aurochs Brewing,64.89382083,35.10617917,53.26839453,46.73160547,- aurochs is a brewery that makes all of its beer from quinoa and millet,"- all the beers tasted pretty good, and I was not able to tell that a single one of them were gluten-free",- the staff was great and really took the time to talk to us about their brewing process.
Aestique Plastic Surgical Associates,64.875,35.125,48.74216524,51.25783476,- summarize the following reviews into 3 distinct bullet points that are grammatically correct and provide clear context,- I think Tara is wonderful,- she made my facial so relaxing and even included hot stones and eyebrow waxing.
Andys Auto Repair Bridgeville,64.87253273,35.12746727,51.93626314,48.06373686,- reviewer was in need of a local auto service to fix a scrape on her car,"- a week later, he got me in right away and had my car finished in the quoted amount of time","- ""any time it comes to automobiles, prices, and work completed, I always get a little nervous"""
Allstate Insurance: Blair Bogdan,64.83985261,35.16014739,53.5430839,46.4569161,"- reviewer: ""if you want to talk to a person and not a cubical this is the place for you"" ""I've been with this agent for years and for good reason","- they've given me good advice for years and years""",
Allegheny Ice Cream,64.83124459,35.16875541,53.28163059,46.71836941,- Allegheny Ice Cream is a cute little ice cream place near the zoo,"- the hot fudge tasted nothing like hot fudge I've ever had before, it was almost bitter","- the blizzard was actually good, but the medium is basically the size of a small."
424 Walnut,64.80654428,35.19345572,61.42722641,38.57277359,"- I was skeptical coming to some little hole in the wall places, but sometimes those little hole in the wall places are some of the best","- I was skeptical coming to some little hole in the wall places, but sometimes those little hole in the wall places are some of the best.",
Arsenal Strength - Crossfit 1812,64.77956744,35.22043256,61.30155955,38.69844045,"- I've never CrossFit in my life, and I am very glad I chose arsenal as my 'box' not only do you get to rock their swag, but they have such a huge cult following and everyone is a motivator regardless of the level you are.",,
All About You Pet Care,64.73196779,35.26803221,50.84173669,49.15826331,"- all about you pet care is attentive, loving, reliable and professional",- she made home visits for a week and a half to care for our somewhat timid cat,"- ""I was referred to this service by a friend and Julie certainly exceeded my expectations"""
Apple Store Shadyside,64.68551587,35.31448413,55.84325397,44.15674603,- this is my go-to Apple Store in the city,"- it's centrally located in the bustling heart of Shady side, and it's Apple what more can I say but GREAT! + Awesome service","- Friendly, knowledgeable staff"
ASCEND Pittsburgh,64.59253247,35.40746753,55.37204024,44.62795976,"- I've climbed at gyms all over the country, and so far this is my new favorite one","- there is an amazing training area with free weights (squat rack! , hang out areas, locker rooms with showers, and a yoga studio",- I can't wait to go back again!
Aladdin's Eatery,64.57611341,35.42388659,59.65472911,40.34527089,- grammatically correct and provide clear context for these 3 reviews,"- if you are looking for fresh, yummy, and healthy food, look no further","- hummus, falafel, fatuous salad, and flavor savor plate are some of our favorites."
Animal Elegance,64.43760889,35.56239111,54.66027875,45.33972125,- I recently adopted an overweight Respond named Drachma,"- she seemed to enjoy the company of other animals, due to the owner working with her",- i wholeheartedly trust Animal Elegance to take proper care of my little furry friends.
Apple Cookie & Chocolate Company,64.40429688,35.59570313,49.0625,50.9375,- CNN's report boot camp asked readers to rate apple cookie company's cookies,- apple has a great selection of cookies,- the chocolate chip cookie is the best thing I have ever tasted.
Amazing Journeys,64.2964436,35.7035564,53.2157688,46.7842312,- the level of detail they put into every trip is insurmountable to any other travel company,- I have just completed my 5th trip with Amazing Journeys and getting ready for the 6th one to Australia/New Zealand in 2016,- I have met some fantastic new friends from all over!!
American Tattoo,64.29140383,35.70859617,50.94217687,49.05782313,- reviews: grammatically correct and provide clear context,- octopus tattoo cost me $250 and people paid $500+ for something less detailed and half the size,- I got my Tagus pierced several weeks ago; the service and price was great.
Arthur Murray Dance Studio,64.26456349,35.73543651,50.12063492,49.87936508,"- single adults, particularly single men, take lessons at Arthur Murray South Hills","- instructors are patient, let us learn at our own pace and are constructive in their coaching","- there are many useful social dances such as hustle, foxy and wedding line dances."
Arnold's Tea,64.23422308,35.76577692,58.44805092,41.55194908,- Arnold's Tea is a great place to have a late lunch on the north side,- there is street parking along with a parking lot on a diagonal behind it,- there is a parking lot on a diagonal behind it.
61C Cafe,64.09375,35.90625,61.77120536,38.22879464,"- the crowd seems a little hipster-like, but not really pretentious or engaging in ridiculous discussions",- hand tamped espresso (my usual choice) is the best I've tried in the city,"- if you want good coffee, this is the place."
Anchor and Anvil Coffee Bar,64.03595526,35.96404474,56.79419192,43.20580808,- I am a self admitted coffee snob,- I do not like Starbucks,"- Anchor has proper espresso machines, and they seem to know how to use them! I am going to have to run there to burn off the extra doughnut calories!"
All Foreign Auto Parts,64.0320262,35.9679738,55.70840682,44.29159318,- I was scammed by some scumbag tow truck drivers after a horrific car crash,- I found exactly what I needed,- Shipped quickly and was packed very well so as not to break
Alter Ego Body Art Studio,64.00606921,35.99393079,55.79511566,44.20488434,"- I've always had excellent experiences at Alter Ego, including the shop's previous identity Z-Spot","- after the first session it looked like it was going to be amazing, after the second session it looked less than stellar","- I've known them for over 12 years, & they have done just about all of my tats & piercings."
Artistic Styles,63.88501082,36.11498918,55.80770107,44.19229893,"- ""I had been growing my hair for some time, and it was almost to my elbows!"" ""I got great service and a great cut!"" ""Sometimes hair stylists are good enough that you want to follow them to wherever they are working""",,
99 Bottles,63.80496454,36.19503546,55.84397163,44.15602837,- the best part of the place for me was actual the customer service from Nick,- the food was very good even though it took 45 minutes to get a salad and sandwich,- ok'd pizza hurt turned into a bar and 6 pack shop.
Alfredo's Salon of Hair Design,63.78499671,36.21500329,62.40118577,37.59881423,- reviews are grammatically correct and provide clear context,"- shop could really use a remodel, reviewer says","- the salon itself felt cramped and not as clean as possible, reviewer says"
Allegheny City Brewing,63.78023337,36.21976663,54.5574297,45.4425703,- the most important part of this review can be summed up on 2 words-DOG,- FRIENDLY,- Allegheny City Brewing offers flights so you can taste more than 1 before making your decision
AJ Bambino Pizzeria,63.66486711,36.33513289,53.36101883,46.63898117,- reviewer says he will never order from AJ Bambino again,- he says delivery drivers will steal from you by adding extra tips,- he says the best deal is probably a large pizza and breadsticks for $14.99.
Arsenal Cider House & Wine Cellar,63.63334125,36.36665875,49.77003484,50.22996516,- reviews: a great place to get out of the summer heat on the first day of autumn,- a great selection of brews on tap for a glass or a growler,"- great ciders with great explanations, tastings, opinions, and wonderful service."
Alder Street Barber,63.58928571,36.41071429,54.64285714,45.35714286,"- reviewer gave me a crappy haircut, and he did the same thing to my friend",- he gave me a classic hipster haircut - super short on the back and super long on top,"- if you don't want an undercut, you should consider looking elsewhere."
Apsara Cafe,63.5866411,36.4133589,50.85168916,49.14831084,- Moran chia around is an original stir-fry of vegetables in a lemongrass sauce,"- the noodle was perfect, with the short spongy rice noodles standing out","- I got my pad thai at a 9, and it was almost too hot for me to handle."
Amazing Cafe,63.58033407,36.41966593,56.40834445,43.59165555,- reviews: solid vegetarian food made with fresh ingredients and a friendly smile,- the peace pizza was also quite leafy and felt pretty comfortable to eat,- the açai bowl was not particularly easy to eat by hand.
"AAAL-Allegheny Attorneys at Law, PC",63.55525031,36.44474969,41.7969068,58.2030932,- reviewer was charged with underage drinking as well as paraphernalia,"- ""I owe Marc my freedom and appreciate everything he, as well as BAAL, did to help me"" ""I would highly recommend Marc to anyone in need of help due to his wealth of experience""",
Above All Grand Salon & Spa,63.52034632,36.47965368,54.81330336,45.18669664,- reviewer received a gel manicure and after only 2 days 5 nails peeled right off,"- ""I'm extremely disappointed as I paid more for these than other salons charge"" ""the professionals who did each of my services were amazing, and I already have an appointment to return""",
Acoustic Moose Cafe,63.51415094,36.48584906,62.55540581,37.44459419,- acoustic Moose is trying to bring art and culture to the dry borough of Bellevue,- most of the acts are acoustic and make decent enough background music,"- the food is okay, as is the coffee, and the music line-up is so-so."
Allison Roth Studio,63.47497815,36.52502185,60.75679876,39.24320124,- I went to Allison Roth Studio to have my Halloween makeup done,"- the studio is small, clean, and super-stylish and the owner is so fantastic","- if you've never tried eyelash extensions, you've GOT to get them."
21st Century Sound & Security,63.4432398,36.5567602,39.42120181,60.57879819,"- I got a car starter installed in December, but the lights came on the way home","- two days later, when I hit the gas, nothing happens","- I take the car back to Jeff to have the starter reinstalled, and he paid the mechanic bill."
Ali Baba,63.41485507,36.58514493,54.76086957,45.23913043,"- All baba's dinner menu includes around 10 entrées and 15 ""à la carte"" items","- hummus, baba fandom, salads and soups were all obviously made in house","- baba fandom, salads and soups were all obviously made in house."
Aldi,63.36543693,36.63456307,58.19755381,41.80244619,- Aldi's is one of my favorite grocery stores to shop at,- they have the best prices on produce hands down,- you can bring your own bags or buy theirs at 6 cents each
A-Boss Opticians,63.31629819,36.68370181,48.82267574,51.17732426,"- the best eyeglass selection, and service, in the Pittsburgh region...without sticker-shock prices","- if you ever need nose pads mounted on plastic frames, definitely go to a boss","- if you need nose pads mounted on plastic frames, definitely go here."
1400 Main Street At Southpointe Town Center,63.29373278,36.70626722,60.62901745,39.37098255,- reviews: the quality of the apartment could be improved in some minor details,- I moved in a week after my official move in date and my apartment was still needing some touch up paint,"- we are currently staying at 1400 Main in a furnished, corporate 2-bedroom apartment."
Aunt Cheryl's Cafe,63.27970876,36.72029124,42.63222789,57.36777211,- Aunt Cheryl's Café is on the street level of a former church in Braddock,"- the food was rather tasty -- red beans and rice, you all -- and the cake was wonderful","- there's Wi-Fi, tasty eats, and friendly staff."
Allen's Spa,63.23809524,36.76190476,46.40079365,53.59920635,- reviews: best eyebrow wax I've ever had and most relaxing pedicures in town,- reviews: pedicure was well done and calf and foot massage was nice,- they open at 11 am on Sundays contrary to what the answering machine says.
Affordable Auto Services,63.23535272,36.76464728,56.3909878,43.6090122,- grammatically correct reviews summarize the following into 3 distinct bullet points,- I couldn't have been more pleased with the cost of my service,- check out affordable auto service 1610 Freeport road in new Kensington.
Anna Skin Care,63.1894872,36.8105128,45.93813131,54.06186869,"- I've been to Anna twice now, once for an express facial and once for the full facial","- I got the Deep Detox, which felt really healing and clarifying for my summer acne",- I've also never had microdermabrasion and have definitely seen a positive difference since.
Allegheny Cemetery,63.14508929,36.85491071,57.19711538,42.80288462,- Père Lachaise cemetery of Pittsburgh is just as beautiful as the famous one in Paris,"- the cemetery itself was gorgeous with marble vaults, buildings, tombstones and statuary",- a family of 15 deer were just relaxing amongst the tombstones.
Ambiance Boutique,63.13999886,36.86000114,59.72040073,40.27959927,- the store is well organized not too overwhelming like most thrift/vintage stores,- the average price was 23-35 and the major designer stuff was between 60-100,- I knocked off one star because I thought the prices were a bit higher than I'm used to in Denver.
Alfred's Deli & Market,63.12978142,36.87021858,51.36885246,48.63114754,"- Located in the original polish neighborhood of Pittsburgh, polish hill is THE ORIGINAL polish deli","- if you are truly looking for AUTHENTIC Polish food, then this is the place you need to be.",
Asiago's,63.1,36.9,55.9037037,44.0962963,"- the food was hot and delicious, and the salads were fresh, and the service was excellent",- I would say 2 out of the 6 had some issue with their meal,- my wife got the ravioli with Gorgonzola sauce and it was perfect.
Alexander's Italian Bistro,63.08255986,36.91744014,46.06080172,53.93919828,"- reviewer: ""if you want a taste of Italy, this is the place"" food was good overall, but the service was rude",- waiter took the cork out of the bottle and set it down on the table and walked away.,
3 Guys Optical,63.04157066,36.95842934,51.25617393,48.74382607,"- 3 guys optical in Oakland, California, offers free eye exam and contact sense fitting","- eyeglasses are my favorite accessory, but for me, it's glasses","- eye doctor was very friendly and professional, and I got my trial contacts right away."
Antiques of Shadyside,63.03813647,36.96186353,51.80601938,48.19398062,- antiques of shady side is one of the best ring stores in the U.S.,- a married couple helped a couple find a ring at the store,- the store has a great selection of antiques and fair prices.
Agnes R  Katz Plaza,63.03194777,36.96805223,58.31725146,41.68274854,- cnn.com's report boot camp challenges reporters to write a review of their favorite places in the city,- ireport.com: do you have a favorite place in the city? Share it with CNN report.,
Affordable Tent & Awnings,63.01414388,36.98585612,56.35,43.65,- affordable tent & awnings has the lowest prices of anyone around,"- the equipment t was in great shape, service was friendly and efficient",- the salesman explained how everything was going to go and didn't disappoint.
Anthropologie,62.95597484,37.04402516,64.87421384,35.12578616,"- the galleria mall is a mystery to me, but it's one of the mall's anchors considering it's not a department store","- the galleria is sort of a mystery to me, but it's one of the mall's anchors considering it's not a department store","- the galleria is sort of a mystery to me, but it's one of the mall's anchors considering it's not a department store."
Advanced Dental Solutions of Pittsburgh,62.91666667,37.08333333,60.72222222,39.27777778,- reviewer was afraid to go to the dentist due to bad experiences in childhood,- he went in a good six months after having broken a molar,- he was able to save his tooth and stop my pain.
5th Avenue Detailing & Car Wash,62.81188725,37.18811275,45.06862745,54.93137255,- Totally impressed with the $99 full auto detailing done,- the most impressive part was the service,- I left a complaint in their phone messaging system hoping to be called back for completion of the job but didn't get a call back yet.
Arefa's Espresso,62.77770147,37.22229853,55.44351263,44.55648737,- reviews: coffee was indeed better than any I have had in Squirrel Hill,- the latte at Area's this morning was one of the worst I've had in a while,- Area's gives you free wireless for 2 hours with each purchase.
Alpine Pools South Hills,62.74296537,37.25703463,66.38961039,33.61038961,- review: Alpine pools installed my inground pool 9 years ago,- review: excellent service on a liner leak,- Found the spot quickly and patched
Aiello's Pizza,62.7306836,37.2693164,50.1910299,49.8089701,"- there are more pizza joints in the 'burgh than anywhere in the nation with 1,000+",- no delivery,- No parking
Area 51 Bbq,62.725667,37.274333,50.35046113,49.64953887,- Area 51 is a new local barbecue restaurant,- the ribs themselves are a perfect balance of tender fall off the bone combined with a chewy seasoned smoked top layer,- the mac n cheese was very cheesy and silky.
Arbors B & B,62.69290123,37.30709877,58.7345679,41.2654321,- summarize the following reviews into 3 distinct bullet points that are grammatically correct and provide clear context,- you can basically come and go as you please so it was very easy,"- the prices are very reasonable, and you are not too far from all the action."
Amy's Hallmark Shop,62.68627816,37.31372184,50.36336757,49.63663243,- if you ever need a gift for someone this is the place to look,- the largest store I've ever seen in which to buy a card for someone is in caste village,"- if you need a card for someone, here you are."
4121 Main,62.65489164,37.34510836,60.14315367,39.85684633,"- 4121 Main is one of my absolute favorite cafés, if just for the coffee itself","- the owners are also florists, and that shows--beautiful seasonal arrangements and decorations",- the only downfall is that there is no free Wi-Fi.
Alpha Athletics: Crossfit 412,62.65191127,37.34808873,53.02000396,46.97999604,"- I highly recommend this gym, whether you are an experienced Cross fitter or new to working out",- Tony and April (the owners) keep a close watch on each members' body mechanics while lifting,- the coaches helped correct old bad habits in training and have helped open my eyes to better nutrition.
Adda Coffee & Tea House,62.57908951,37.42091049,63.60339506,36.39660494,"- reviewer says coffee shop is pretentious, but without the baristas who is a judge and glare at you regardless of what you do like in some other places","- instead the baristas are consistently friendly and down to earth, and the coffee is wonderful (especially the cappuccinos - they have real cappuccinos with correct proportions)",
#1 Cochran Kia - Robinson,62.57852919,37.42147081,46.20103474,53.79896526,- reviewer says he was refused an appointment for his new Sorrento's 1st oil change,- he said he would be cared for within 20 minutes if he showed up on his day off,- reviewer says he's never left with an issue unresolved.
Ambridge Italian Villa,62.52923977,37.47076023,64.98538012,35.01461988,- Stromboli is my favorite place to eat at,- Exceptional variety,"- Delivery is usually quoted at an hour wait, but will often be longer"
Always Open Locksmith,62.45582251,37.54417749,50.64770563,49.35229437,"- Ben came right when he said he would, and got me into my house in 5 seconds",- he arrived on time and was super knowledgeable about the types of locks in our house,- he even answered some other security questions about our home while he was working.
Allegro Hearth Bakery,62.44509657,37.55490343,53.93388556,46.06611444,- allegro has the best bread in Pittsburgh,- it's yeasty and crusty and perfect,- I was not a fan of the cupcakes; the frosting left much to be desired
Aero Tech Designs,62.42175889,37.57824111,53.9460034,46.0539966,"- Aero tech designs has a great selection of cycling apparel - all kinds of styles, colors and sizes","- most importantly, their prices are VERY reasonable and all of their apparel is made in the USA","- if I could give them 10 stars, I would!!"
Al's Cone Zone,62.4196933,37.5803067,51.9503632,48.0496368,"- reviews: peanut butter cookie ice cream sandwich, chocolate chip cookie ice cream sandwich","- ""All's is awesome! If you have an ice cream craving.","- visit all's!"" ""The only reason i didn't give them 5 stars is the parking and pulling out from there can be tricky"" ""the only reason i didn't give them 5 stars is the parking"""
Applebee's Neighborhood Grill & Bar,62.39029791,37.60970209,60.55958132,39.44041868,"- review: ""food was cold and inedible!"" ""Service friendly",- Food just meh,"- Wouldn't walk across the street for it"" ""my dad's burger was pretty huge and the toppings on the bourbon burger made it definitely something different"""
A 1 Garage Door,62.3655303,37.6344697,40.47474747,59.52525253,- reviews: grammatically correct and provide clear context,- Stan arrived at our house a few hours after our initial call,"- gave us a quote, fixed the spring, checked the opener and greased the tracks, rollers and spring."
Alfred Angelo Bridal,62.28095762,37.71904238,55.7998301,44.2001699,"- reviews: ""I was thrilled with the service my girls and I received at Alfred Angelo"" ""my mom's dress looked like it was from Walmart","- the beads were falling off, and you could see all the thread through the dress"" ""I was so excited about these dresses, and I am so disappointed that they arrived like this""",
A & T Nails,62.25608586,37.74391414,58.74131313,41.25868687,"- reviews: fast, great customer service and great price","- ""I have been to A&T Nails twice now","- the staff is VERY friendly, and do great work!"" ""The technician at A&T, a younger girl, was EXTREMELY knowledgeable and informative"""
AdultMart,62.25421063,37.74578937,47.38132816,52.61867184,"- Adult mart is a lot bigger with a larger selection of ""novelties"" ""walking in you are always greeted with a smile, hello, and is there anything I can help you find"" ""they check ID's every time I have gone in""",,
4 Paws Veterinary Care,62.2375731,37.7624269,65.92690058,34.07309942,- 4 Paws Veterinary Care opened in January,- 4 Paws Veterinary Care makes you feel like your pet is their only patient,- take my advice and do not go here
Asian Kitchen,62.23214286,37.76785714,54.53463203,45.46536797,- the red curry with tofu is my favorite,"- the tofu is good, chicken and shrimp are average",- Haven't tried the beef
Aracri's Greentree Inn,62.21367521,37.78632479,52.57692308,47.42307692,"- the owner and his employees are the best!!! They are kind, friendly, and easy to talk to people","- the food was cooked well, but lackluster",- I got veal piñata which mostly had the flavor of flour and beef broth.
Arleo's Pizza,62.20725575,37.79274425,61.48706897,38.51293103,- the way the flavors meld is unheard of in other chains,"- to me, it's like they painted a picture with flavor",- the way the flavors meld is unheard of in other chains
Andrew Leo Hair Salon,62.11771628,37.88228372,49.51745345,50.48254655,- autumn is the only hairdresser I've had who can make my hair look great short,"- the salon is clean, friendly, and reasonably priced compared to other salons of this caliber",- if you are new to the city or are looking for a new place to go 110% go to autumn.
Absolute Ballroom & Dance Center,62.02886905,37.97113095,53.02261905,46.97738095,"- Absolute ballroom isn't the snooty, stuffy dance studio Nurse Matched retired to after her job at the hospital","- the studio offers a wide variety of dances including ballroom, salsa, Tango, and west coast swinging",- the main dance floor is somewhat narrow but has a really nice surface for dancing.
Altar'd State,62.02348317,37.97651683,61.33286572,38.66713428,- a few items have marked with your purchase that a portion of the proceeds go to help needy children,"- the clothes here are cute, but they don't have many things that would be flattering on a full figured person",- there is an awful perfume smell that is overwhelming and makes it hard for me to breathe.
Always Compassionate Veterinary Care,61.98119975,38.01880025,53.79665097,46.20334903,- CNN's report boot camp challenges reporters to write a review of a vet clinic,- the reviews are grammatically correct and provide clear context,- ireport.com: do you have a pet? Share it with the world.
