Business_name,positive,negative,factual,opinion,summary1,summary2,summary3
Angelo's II,57.41823101,42.58176899,54.03982684,45.96017316,"- reviews: ""wow...nice folks, but the food was terrible"" ""the onions on the top of the pie were cold, and the anchovies were directly out of the can"" ""if you want delicious you'll have to pay a little more,"" says one reviewer.",,
Animal Advocates Thrift Shoope,57.41630897,42.58369103,55.05411255,44.94588745,"- I'm allergic to cats, so I was pretty much fighting the sniffles and hacking the rest of the afternoon","- this place is a must-go to place as it's a good cause, and they have some really nice things",- they also have some pet supplies too so you can buy clothes for your dog without feeling guilty you bought clothes for your dog.
American Airlines,57.40344014,42.59655986,48.5684716,51.4315284,- cnn.com's report boot camp challenges reporters to be more flexible,- ireport.com: do you fly with a company that uses American Airlines? ireport.com: do you fly with a company that uses American?,
Antonio's Pizzeria,57.39806548,42.60193452,54.3735119,45.6264881,"- reviews: pizza was a little soggy, but you got generous toppings",- sauce was ok but too much crust,- wings were large and the buffalo was hot
Arsenal Park,57.34588068,42.65411932,58.56423611,41.43576389,"- the park has a basketball court, baseball diamond and 4 tennis courts",- it was established as an industrial site in 1862 for the making of munitions,"- 78 lives were lost, mostly young female workers during the civil war."
Allegheny County Custom's,57.32165404,42.67834596,48.20027195,51.79972805,- do yourself a favor and give them a try,- you won't be sorry,"- I love this place, they do excellent body work and service, plus they price everything reasonably"
Advance Auto Parts,57.3147134,42.6852866,51.54953146,48.45046854,- it's been a little over two years since I got a new battery from Advance Auto in Marysville,- a few weeks ago I tried to start my car and it wouldn't start,"- I got a new battery from Advance Auto, and it came with a 3-year warranty."
Atlas Dental Specialists,57.28123952,42.71876048,51.98806703,48.01193297,"- review: ""I was looking for a dentist and found Dr","- Duncan-Friedman online"" review: ""I'm afraid her appointment book is going to explode faster than you can say"" ""she puts even the hugest scaredy-cat (*cough* me*cough* me*cough* me) at ease""",
American Cafe,57.25781642,42.74218358,46.85602472,53.14397528,"- if you don't give the American café at least 3 stars, then you're just a commie pinko spy",- the American is a great classic dive bar,"- the smoke in there though is a killer, and it could use a little sprucing up."
A&L BMW,57.2553642,42.7446358,43.83774076,56.16225924,- cnn.com's report boot camp challenges reporters to write a review,- ireport.com: what do you think? Share your thoughts with CNN report,- ireport.com: share your experiences with CNN report.
American Laser Skincare,57.22582973,42.77417027,45.30844156,54.69155844,- reviewer's legs have a weird pattern of hyper and hypo pigmentation,- American laser center isn't the location's fault as much as it is the entire company's fault,"- the staff is awesome, however the product isn't."
Appliance Warehouse,57.17924702,42.82075298,51.76905418,48.23094582,"- appliance warehouse is a great place to buy quality, used appliances",- they recycle people's appliances by fixing them and selling them at reduced rates,- they recycle people's appliances by fixing them and selling them at reduced rates.
A Peace of Eden Spa,57.15533146,42.84466854,45.19418386,54.80581614,- peace of Eden spa is a must-visit for anyone seeking a relaxing spa experience,- the spa is a must-visit for anyone seeking a relaxing spa experience,- the spa is a must-visit for anyone seeking a relaxing spa experience.
Angie's Restaurant,57.02384696,42.97615304,55.59224319,44.40775681,"- the service was slow, and the kitchen matched its pace",- the Alfredo was cold - it tasted better microwaved the next day,"- the spinach rolls were ok, not great but the high point of the meal."
Allstar Arbor Tree Service,57.00618341,42.99381659,55.50532725,44.49467275,- cnn.com's report boot camp challenges you to rate a tree removal company,- cnn.com's report boot camp challenges reporters to rate a tree removal company,- cnn.com's boot camp challenges reporters to rate a tree removal company.
ALDI,57.0058215,42.9941785,49.81239515,50.18760485,- Aldi and bottom dollar are like long-lost siblings,- both are discount grocery stores where you bring your own bags and bag your own groceries,- at Aldi you need a quarter to get a shopping cart that is returned once you return the cart.
Aldo Shoes,56.99894593,43.00105407,50.00744048,49.99255952,"- Aldo has a great selection of shoes, more jewelry than the other stores in Pittsburgh",- the staff were truly upbeat and attentive to everything that was going on in the store,- the staff was truly upbeat and attentive to everything that was going on in the store.
Asian Star,56.97058824,43.02941176,54.89433551,45.10566449,- reviewer was pleasantly surprised with the food at Asian Star,- fried rice was a little too oily,- fried rice was too greasy and breaded
Angelias Italian Grille,56.91280864,43.08719136,52.09670782,47.90329218,"- the food is always very good, and the service is super friendly","- the flavor selection is not wide, and there's nothing there that even comes close to satisfying my need for sheer burning spiciness","- even on the tightest recent-graduate budget, Tuesday night at Angelia's is affordable."
Ace's Breakaway and Play,56.89415709,43.10584291,43.72605364,56.27394636,"- if you enjoy pinball or arcade games, you should definitely stop in on your lunch break or after work","- if you work downtown, and you enjoy pinball or arcade games, you should definitely stop in on your lunch break or after work.",
Arhaus,56.83714286,43.16285714,57.44735931,42.55264069,"- I have furnished 90 percent of my home with Århus items including a sectional sofa, chair and ottoman, accent tables, lamps, dining table and chairs, etc",- I have tried a variety of different furniture cleaners and polishes and cannot restore the surface without smudging and streaking.,
Aero 360,56.82204861,43.17795139,52.93030754,47.06969246,- the Aero 360 is one of my favorite rides at Kenny wood park,"- it's designed to swing like a pendulum, starting out low and eventually going around in a 360 degree loop",- the are 360 is my favorite ride in all of Kenny wood park.
1-800-Haul-Out,56.82084068,43.17915932,47.16453557,52.83546443,- reviewer bought a voucher for $99 that gave him 1/4 of a truck,"- as they moved down the pile they ran into a bee nest, and one of them was allergic",- two younger guys showed up on time and moved an organ for me.
Associates In Opthalmology,56.75347222,43.24652778,52.02852183,47.97147817,- I had laser cataracts surgery here a few weeks ago and astigmatism corrected as well,- surgery was quick and painless and results were immediate,- I had to go to have a simple 4-minute test done on my eyes.
Allen's Spa Nail Salon,56.74869866,43.25130134,52.91262406,47.08737594,"- if I could rate 0 stars, I would",- Awful experience! Awful service! Don't waste your time or money! The only way I would ever go back is to DEMAND a refund.,
Adore Hair Studio,56.71401515,43.28598485,51.3037518,48.6962482,- I recently visited this salon for an 'accent highlight' as they have listed on their services menu,- 5 hours later (literally) I left with purple hair extensions and the extensions cut off to nothing,- what should have been a simple 1-hour service turned into 5 and a disaster costing me $750 in new extensions
Air Canada,56.64804293,43.35195707,58.05560065,41.94439935,- I'm going to give 5 stars for great customer service over the phone,"- I've flown a lot over the past few years and every time I fly on a turboprop, I half expect to see the ground crew start the propellers manually","- if you are flying between Pittsburgh and Toronto, you almost have to fly on Air Canada Jazz."
Angels Automotive Service,56.62878788,43.37121212,42.31452456,57.68547544,"- the exterior is a bit Dodge, the interior a bit scrappy, but it's a garage not a hotel",- the shop allows you to bring aftermarket parts and charges a reasonable labor charge.,
Applebee's,56.58539377,43.41460623,44.98778999,55.01221001,"- reviewer: ""I cannot remember ever having a good meal at any Applebee's anywhere"" ""the manager was berating the hostess in front of all the customers"" ""the place was stuffed with people because of happy hour and their specials""",,
Au Bon Pain Co,56.55564404,43.44435596,53.59932206,46.40067794,- reviews of AU on pain on Bristol are grammatically correct and provide clear context,"- the food was good, but the service was not good",- the staff are friendly and learn a lot of the customers names.
All Washed Up Auto Spa,56.54488154,43.45511846,52.86467669,47.13532331,"- review: ""the right touch wash took the LE badge off my car","- luckily the adhesive is still there"" ""I paid $11 for the ""Royal Treatment"" and my car came out very clean","- ""it was the BEST automatic wash my car has ever seen,"" says reviewer."
31st Street Pub,56.54110222,43.45889778,55.73186918,44.26813082,"- the 31st street pub was packed, but not so packed you were squeezed up on everyone",- the bar is decorated with all kinds of cool stuff to check out,"- the ambiance in here is ""punk rock dive bar"" through and through."
Angelia's Pizza,56.49525817,43.50474183,58.00368481,41.99631519,- reviewer says pizza was out-freaking-standing,"- food was good, but wings were dry and hard, he says",- chicken filly is my go-to when we move to PA in 2 weeks.
Albert Anthony Real Estate,56.48801632,43.51198368,45.91848846,54.08151154,"- ""what a REAL family company this is!"" says Kate Davis-flynn","- ""they posted pictures of a BEAUTIFUL house,"" says Davis-flynn","- ""they posted pictures of a BEAUTIFUL house,"" says Davis-flynn."
Allegheny North Veterinary Hospital,56.46514207,43.53485793,46.59300919,53.40699081,"- five stars for service, 5 stars for expertise and 5 stars for price",- kitty Mitzi has been losing weight steadily over the past several months,"- all in all, 5 stars for expertise and 5 stars for price."
Alberts Gifts,56.44235009,43.55764991,48.30540858,51.69459142,"- the craziest find for me was the ""my cat purrs black and gold"" magnet",- there are tons of dog products and cats are usually left out,"- overall, a great store to visit if you aren't sure what to get your favorite sports fan."
All Things Aquatic,56.43000821,43.56999179,41.78626163,58.21373837,"- reviews: a below average instructor, at best, but is even worse at running a business",- reviews: a scuba instructor is someone you should have complete trust in,- a scuba instructor is someone you should have complete trust in.
Apple Store,56.36143194,43.63856806,52.67776122,47.32223878,- reviewer's daughter's iPhone 6 Plus got smashed at prom,"- the store gave her a replacement and set up new Apple ID (we were sharing one) reviewer: ""I didn't really get the understanding and helpful ear that I'd expected from a store known for their customer service""",
Allegheny South Veterinary Services,56.27777778,43.72222222,57.72990544,42.27009456,- the vet techs have let me down several times,- the last time I went there my cat got unruly so they trimmed only half of her claws,- this has been the worst and last visit I will ever have here.
A & M Family Tires,56.25617589,43.74382411,50.49407115,49.50592885,- grammatically correct and provide clear context,- a & m is a great place to get a new tire,- a & m is a great place to get a new tire.
Andrew John Salon,56.24298228,43.75701772,62.55505952,37.44494048,- I had a horrible haircut and would not recommend this salon to anyone,- the stylist cut the one side my of bangs so short (and right at my part) that it looked like a nub on my forehead,"- the ambiance is superb-small, quaint, and not full of egos."
A Pittsburgh Plumber LLC,56.14935065,43.85064935,41.02741703,58.97258297,- grammatically correct reviews provide clear context,"- ""I couldn't be happier with the quality of his work, or his prices"" ""never showed up to assess gas pipes and never called to at least reschedule""",
Alpine Pools,56.09435452,43.90564548,37.37609009,62.62390991,"- reviewer: ""this is the worst place I've dealt with in many years"" reviewer: ""this is the worst place I've dealt with in many years"" reviewer: ""it is not believable that 2 people rated this company positively""",,
Ambridge Do It Best,56.06865957,43.93134043,47.0047775,52.9952225,- the best thing about this store is the people who work there,- prices might be a few percentage points higher than some other places,- Cambridge do it best has a person to assemble the grill and a two-man team to deliver it.
1-800-PACK-RAT,56.00907773,43.99092227,53.79983442,46.20016558,- reviewer's mother-in-law used pack rat to move her belongings from PA to Florida,- she paid extra money for a delivery on Friday and was told it would not be available until Monday,- Pack rat dropped of the container when they said would and was right on time getting it out of the street.
Armand's Bar,56.00453515,43.99546485,52.7845805,47.2154195,- Armand's is the home of some of the cheapest PBR pounder 6 packs ever,"- the bar itself is small, and would be considered a cozy-dive bar if the patrons weren't smoking like chimneys","- the cornmeal breading is phenomenal, and it isn't greasy like some others."
Asti's South Hills Pharmacy,55.96230159,44.03769841,60.71428571,39.28571429,- Anti's in south hills is a great pharmacy that goes above and beyond to help its clients,- they are over the top when it comes to giving individual attention and in helping people through tough situations,- this is not your normal pharmacy
AVA Bar & Lounge,55.88849206,44.11150794,51.25202047,48.74797953,- first Thursday of every month 5:308:00 - Global Pittsburgh First Thursdays at AVA Lounge,- Open to public,- come and see for yourself
Allison McGeary Events,55.85175463,44.14824537,50.52892143,49.47107857,- reviewer's only complaint was that she couldn't do the flowers for her wedding,"- reviewer: ""the service was disappointing","- after learning of comparable services, also overpriced"" reviewer: ""I was blown away by how well she took care of me and my party"""
#1 Cochran Hyundai of South Hills,55.8334875,44.1665125,44.97995831,55.02004169,- reviewer's issues with Cochran Hyundai revolve around the deceptive nature of her car buying experience,"- Cochran Hyundai of south hills gave me a quote of 23,306","- when it came time to purchase they pulled out a price of 24,600."
Auto Asylum Car Care Center,55.76262626,44.23737374,33.75252525,66.24747475,"- reviewer bought a Groupon for this place, but their number is disconnected",- Groupon and I have both tried contacting the company and have both failed,- car looks like new! Much better job than other detailing I've had done.
Alberta Modern Hair,55.69673556,44.30326444,51.47002997,48.52997003,"- I went to Alberta for about 2 and a half years, and the only reason I stopped was because I moved out of town","- at $85 for a cut and color, I can't find anything close to what I got at Alberta for that price","- as a blonde, my color can be tricky to get exactly right."
Altmeyers,55.62234903,44.37765097,41.99811973,58.00188027,"- reviewer was looking for large or king-sized pillow cases...no such luck, they only carry the standard size",- she also wanted new pillows for her new living room,"- the manager never looked up, never asked if there was a problem."
Asiatique Thai Bistro,55.57676968,44.42323032,58.87695072,41.12304928,- not a single speck of chili on my See Ew noodles,"- I asked for hot sauce and was given Sriracha, while delicious, doesn't really set the tongue on fire","- the decor is fine - not spectacular, but better than average for the type of restaurant."
Arby's,55.55814229,44.44185771,55.36020589,44.63979411,- Arby's is definitely king of the fast food joints on the Blvd,"- however, it's still fast food, which explains the mediocre rating","- the staff here is very nice and very fast, and on the whole, the food is better than elsewhere by the river."
A Ward's Cheesecakes,55.44329574,44.55670426,40.4048583,59.5951417,"- grammatically correct, these reviews provide clear context",- the triple chocolate cheesecake they make is decadent beyond belief,- a retail store is supposedly coming soon
Allegheny Health Network Urgent Care Center Braddock,55.44027778,44.55972222,64.32962963,35.67037037,"- AHN bills your carrier for the most they can get and if they don't get it, they come after you",- the reception was not only rude but uninformed,- the front desk staff was friendly and efficient.
Asian Cafe,55.39472,44.60528,51.51515152,48.48484848,"- reviews: the food here had a very fake, manufactured flavor, like what you'd get from a frozen Healthy Choice meal","- the service is really fast, and the crab Rangoon are a step above in quality",- the prices are low because quality is just about as low as the customer service.
Asian Rice Bowl,55.37727755,44.62272245,41.65291751,58.34708249,"- reviewer: ""this guy rocks wok Ha in a way that only rarely seen"" he cooks the food, right in front of you, and you eat it hot off the wok","- if you're down for some good ole Americanized Kitty & Rice, you're in for a treat.",
American Mold Remediation,55.3607465,44.6392535,49.83172303,50.16827697,- cnn.com's report boot camp challenges reporters to share their experiences with mold remediation,- ireport.com: do you have a mold problem? Share yours with CNN report,- ireport.com: do you have a mold problem? Share your experience.
ARS Pittsburgh,55.35620629,44.64379371,50.6706488,49.3293512,"- avoid ARS Pittsburgh at all costs, says CNN's Nina dos Santos","- avoid at all costs, says dos Santos","- avoid at all costs, says dos Santos."
AJ's Burger & Peruvian Chicken,55.35387356,44.64612644,59.26989677,40.73010323,- if you want sweet potato fries go to Fuel & Fuddle or UPMC Manticore 7th Café,"- chicken was okay not the best I've had, and the fries were a nice fresh-cut surprise",- the fries were like beach fries with sea salt but a little greasy.
412 Detailing,55.33076735,44.66923265,55.83589932,44.16410068,- I recently took my wife's neglected 2008 Jeep Commander in for a sprucing up,- 412 detailing did a great job at making a very neglected SUV look great again,"- I love my car and try and take perfect care of it, but have terrible depth perception."
Albert's Tire & Service Center,55.2582846,44.7417154,41.25243665,58.74756335,- reviews: Albert's Tire was possibly the best example of customer service in years,- most places in the area are closed Saturday and Sunday for repairs,"- reviews: ""they're the best example of customer service that I've experienced in years"""
Alan's Pet Shops,55.23859186,44.76140814,48.49791046,51.50208954,"- a pet store in the squirrel hill area sells fish, birds, rodents and reptiles",- the owner is friendly and knows his stuff fairly well,- the negatives were DO NOT TOUCH THE GLASS or point closely at any fish.
Andora,55.23580034,44.76419966,58.4939759,41.5060241,"- reviewers have been to this charming old inn many times, and almost every time, they are pleased","- the food is poor, undercooked bread, bland soup, boring menu",- Too bad
Adams & Associates,55.21590909,44.78409091,47.08892496,52.91107504,- don't use this accountant if you own a business or just work in general,- he will promise unlimited telephone communication,- end of year taxes will always be wrong
America's Best Contacts & Eyeglasses,55.19844473,44.80155527,53.30987808,46.69012192,- reviews: this was the worst costumer service experiences I've had in my entire life,"- a lady at the reservation desk frowned, snarled, and barked commands like we were in a prison",- the downtown office has ruined America's Best for me forever.
Auntie Anne's,55.19411376,44.80588624,55.0271164,44.9728836,- the salt pretzel that I got was soft and slightly sweet on the interior with a slight crunch on the exterior,- the salt pretzel that I got was soft and slightly sweet on the interior with a slight crunch on the exterior.,
All Star Sports Bar And Grill,55.09883936,44.90116064,50.76985237,49.23014763,- the fires tasted fresh cut,- Lots of beer on tap with a ridiculous amount of TVs,"- the waitress was not very attentive, drinks were small, but they were also cheap"
Atria's - Norwin,54.89552545,45.10447455,55.86757974,44.13242026,- the waitress didn't give us the special menu when we were seated,"- the steak salad was delicious, but under cooked",- the waitress seemed to be preoccupied and never asked if the steaks were prepared well.
#1 Cochran Nissan,54.85395081,45.14604919,51.010918,48.989082,- avoid #1 Cochran Nissan at all costs,"- don't sell your car for less than you'd planned, since it's not a 2016","- don't sell your car for less than you'd planned, since it's not a 2016."
Alamo Rent A Car,54.85359548,45.14640452,51.72318422,48.27681578,- reviews are grammatically correct and provide clear context,"- I expected a clean car that ran well and was dependable - I got a Dodge dart with 9,000 miles","- I expected no hard pressure sales gimmicks about prepaid gas or coverage-these were mentioned during the registration process, but we're not pushed."
Arena Sports Grill,54.79662698,45.20337302,47.31068122,52.68931878,"- reviews: ""the angel hair was mush"" ""the pretzel bites were hard as a rock n the cheese sauce was burnt n cold"" ""the service was awful","- I had to wait over 5 minutes for someone to seat us when there was only one other table""",
Alco Parking - West General Robinson Street Garage,54.77373402,45.22626598,54.74067922,45.25932078,- this garage is my go-to when I am visiting the North Shore to have dinner or to PNC Park,- parking is usually $5.00 Sometimes it is hard to get into the other parking lots in the area,- this garage is a great place to park when going to stage AE for a show.
Adrian's Pizza,54.75112146,45.24887854,47.06636761,52.93363239,- the delivery person called our house a few times,"- instead of an apology, a manager HUNG UP on us",- the chicken and broccoli pizza is delicious! I ordered carry out and had no problems
Anthony Arms & Shooting Center,54.64502949,45.35497051,57.24866679,42.75133321,"- at its best it's slow but friendly, and at its worst it's downright mean-spirited, and rude","- at its worst it's downright surly, mean-spirited, and rude",- the service is frighteningly inconsistent.
American Home Services,54.62959012,45.37040988,31.16596639,68.83403361,"- reviewer: ""they"" are just one guy who sells projects, then tries to pull together enough workers","- he will lie about actual costs, he will overpromise and under deliver, he says","- he is not to be trusted, reviewer says."
Arnold Furniture,54.58647008,45.41352992,47.47862257,52.52137743,- reviews: Elise Leach was incompetent with all that dye it must have fried a few brain cells,"- reviews: ""if you want REAL furniture with a knowledgeable team this is not the place to go""",
Allegheny HYP Club,54.57989969,45.42010031,52.40928215,47.59071785,"- the Scotch was great, and their new executive chef can cook the man is a genius with food","- the egg was a cold, shrunken, disgusting mess, with a greasy sausage patty","- the buffet included juice, coffee, tea, bagels, egg, sausage or ham, and cheese sandwiches."
Amato's Pizza,54.57615891,45.42384109,55.44365079,44.55634921,- reviews: worst pizza I have ever tried,- it was so bland with almost no flavor,- staff was extremely rude to the point of being near hostile
105.9 The X,54.55988456,45.44011544,51.5464917,48.4535083,- 1059 The X has struggled to keep a hard rock format,"- the station has incorporated a TON of alternative rock and ""stoner music"" ""Double M"" ""The Super Genius"" aka MALE CHAUVINIST PIG"" is a DJ.",
American Window Industries,54.5414576,45.4585424,38.1272137,61.8727863,- a window that the owner said they didn't need to replace broke about a week later,- a window that the owner said they didn't need to replace broke about a week later,- American windows industries is a company that preys on people who don't ask too much.
AAMCO Transmissions & Total Car Care,54.47839631,45.52160369,42.21970449,57.78029551,- reviews: the best mechanic I have had experiences with in my adult life,- Brian calls you once the car is opened up and then diagnoses the problem,- after fixing the car he actually brings out the old part and explains everything they did to fix the car.
Au Bon Pain,54.47263072,45.52736928,53.2340372,46.7659628,- if you're looking for a quick cup of coffee or breakfast in downtown this isn't a bad place to check out,- the prices weren't as outrageous as I thought they would be based on other reviews,- the women behind the counter making the salads and sandwiches really do have the most terrible attitude.
Arpino Trattoria,54.47114337,45.52885663,50.2588554,49.7411446,"- reviewer: ""this was a nice little BYOB Italian restaurant that I would like to eat at again"" ""I had a cup of wedding soup with my meal, and was not impressed, bland and had the penne vodka"" ""the bread was a little disappointing, and the bread was a little disappointing""",,
Anderson Jim Auto,54.42574179,45.57425821,49.76594066,50.23405934,- reviewer says he was ripped off by a shop that told him he had lifetime warranty,"- ""efficient and expert auto service, fair prices,"" says reviewer","- ""everyone who wants to avoid bankruptcy needs to find a good independent shop,"" says reviewer."
