Business_name,positive,negative,factual,opinion,summary1,summary2,summary3
Aurelia's Coffee & Cafe,61.97674419,38.02325581,65.9569952,34.0430048,- three stars because I've never been,- I had a chicken sandwich with thinly sliced green apple and Gouda cheese,- I hope to have one of my wine dinners here
#1 Cochran Subaru,61.97032738,38.02967262,52.04825397,47.95174603,"- reviewer's first few visits were decent, but my last visit was not","- he paid almost 100 bucks for his oil change, tire rotation, etc","- the service however, that's lacking"
Andys Wine Bar,61.95673077,38.04326923,47.69871795,52.30128205,- reviews: nice place to hang out and have a drink between dinner and dessert,"- prices are appropriate to the hotel it's situated in; this is not the Days Inn, folks","- drinks are proper for the most part, food is decent, and the people-watching is always entertaining."
ACE Hotel Pittsburgh,61.95657189,38.04342811,55.8780931,44.1219069,- the Ace Hotel is located on S Whitfield St in the former YMCA building,- the hotel has retained the original black and red tiles in the ballroom as well as in the elevator,"- the bartender was attentive, and the drinks were on point."
All India,61.95294785,38.04705215,58.2589104,41.7410896,"- I've only ever been here for the lunch buffet, and it's pretty good","- there are many different chicken options - Tikki masala, tandoori, regular curry, chili, and sometimes goat and fish.",
Anytime Fitness,61.93657731,38.06342269,53.53994154,46.46005846,- anytime fitness is a personal trainer based in San Francisco,"- anytime fitness offers a variety of workouts, including cardio, the elliptical and treadmill",- anytime fitness is open to all ages and fitness levels.
Al's HVAC Services,61.9080705,38.0919295,52.55675119,47.44324881,"- reviewer: ""if you're not using Al then you're paying too much for less quality work"" reviewer: ""I hope our experience was an anomaly, but buyer beware"" reviewer: ""if you're not using Al then you're paying too much for less quality work""",,
Antoon's Pizza,61.87730612,38.12269388,56.83910534,43.16089466,- the Anton's large plain pie is less than 5 dollars,- the large cheese pizza is $6.00 plus AWESOME! Pizza is actually very good and can't beat the deal,- the pizza is actually very good and can't beat the deal.
Adrian's Pizza and Six Packs,61.87224026,38.12775974,54.39380952,45.60619048,- my girlfriend suggested eating in because it was associated with Marietta Winery,- service was friendly and quick,- we sat in front of the window on a sunny evening
Ann's Spa and Nails,61.86504329,38.13495671,44.62857143,55.37142857,"- the technician was nice, but seemed to just rush and slop through the process",- I don't consider this establishment to be much of a spa,- I wish I would have walked out with my money and the time I wasted.
Anya Salon,61.779326,38.220674,54.16716771,45.83283229,"- reviewer: ""I hate getting my hair cut because no one ever seems to get it right"" ""I felt like a rock star when I walked out of the salon"" ""the staff was really friendly and did a great job on my hair""",,
Amazon Cafe,61.77083333,38.22916667,62.15447154,37.84552846,"- the Amazon café serves up smoothies with the best of them, and provides a small assortment of soups, sandwiches, and wraps to compliment their healthy drinks",- the wraps managed to hold their own - as far as flavor goes - against the marquee smoothies.,
Alan Kells School of Real Estate,61.75416667,38.24583333,48.49166667,51.50833333,"- this is the only Real Estate school I tried, so It's hard to gauge their level of luckiness",- the instructor was excellent and had a strong teaching background,- the weekend courses are definitely worth your time and $$.
Arkham Gift Shoppe,61.74080871,38.25919129,46.94910323,53.05089677,"- a comic book store lives and dies on the strength of its proprietor, and that's what makes Arkham Special","- the store is friendly to your typical male geeks, but feels safe and fun for women and young children as well.",
Alma Pan-Latin Kitchen,61.72061788,38.27938212,56.42764473,43.57235527,- the cantina section of Alma is actually Latin American food focusing on African influenced items,- the vegetarian Torrential de frivolity ($11) is a pan-seared legume cakes served with collard greens and ripe plantains.,
Asian Food Market  Bobae,61.70296717,38.29703283,45.30218855,54.69781145,- grammatically correct reviews provide clear context,- small yet nice Asian store is packed with cooking implements,"- owner's/staff lady is sweet, and will help you find items you might need"
Allegheny Branch YMCA,61.69878747,38.30121253,49.96518654,50.03481346,- I'm still giving this Y five stars because I like the other patrons and the atmosphere so much,- the pool is fine if you aren't really hardcore into swimming,"- if swimming is a major form of exercise for you, it might not be the best pool for your needs."
Allegheny Coffee & Tea Exchange,61.68927649,38.31072351,54.85589346,45.14410654,- Into coffee was really cool and worked really well as an iced drink on a hot day,- the shop in general was really cool and fragrant as well,- the staff is very friendly and always seems like they're willing to help or make a suggestion.
AMF Mt. Lebanon Lanes,61.68625277,38.31374723,51.28233555,48.71766445,- the bowling alley is kind of old and dated and does not appear to be the cleanest,"- the TV screens showing football games, basketball games, etc",- are old
Albert's Lounge,61.60861522,38.39138478,46.16354576,53.83645424,- Albert's is a good dive bar that fits the bill for a great place to drink with friends,"- while it's a smoking bar, half of the bar is designated as non-smoking","- bartender was very nice, but you could tell she's new."
Anthony's Coal Fired Pizza,61.53953666,38.46046334,55.03094102,44.96905898,"- reviews: pizza, two beers, salad, and two craft beers",- place is noisy and not conducive to conversation,"- service was good, but the falling out of her top, overweight manager, was a little overbearing."
Addicted Salon Spa & Tanning,61.51548998,38.48451002,54.41088193,45.58911807,- addicted salon and subsequently Bridgett's stylists are legit awesome,"- if you have ever had a bad experience in a salon or have just felt like the salon wasn't a 'good fit' for you, please check out addicted.",
Artist & Craftsman Supply,61.49119544,38.50880456,53.25210813,46.74789187,- artist & craftsman is the best art shop I've ever been to,- staff is intelligent and totally nerdy about supplies and art which is what I wanted,- prices are typical of a fine arts store and are fair.
AAA Scrap Metals,61.46825397,38.53174603,51.89880952,48.10119048,"- AAA scrap treats ppl like they are family, they unload everything themselves plus pay a very nice price","- AAA scrap treats ppl like they are family, they unload everything themselves plus pay a very nice price.",
Art F X,61.44460979,38.55539021,54.17609127,45.82390873,"- I've always had issues with piercing my ear, and the Pierce Jenny has been the most helpful","- she uses the wrong gauge in multiple piercings, too short of jewelry, and still uses clamps",- I would definitely recommend Jenny for a piercing of any kind.
Apollo Cafe,61.40962598,38.59037402,56.34849562,43.65150438,"- ""apollo"" is one of the best breakfast spots in downtown Pittsburgh","- ""apollo"" opens early for those early workers to have a hot meal before starting the morning shift","- ""no diner-like service would complete without the fast talking always-in-a-hurry blunt order taker"""
Anne Gregory For the Bride,61.37873879,38.62126121,51.07424151,48.92575849,- Anne Gregory is the exact opposite of David's Bridal,"- Gregory's selection of wedding dresses is to die for, and they know exactly what to choose for you",- every dress Gregory chose for me was better than the last.
Allstate Insurance Agent: Jo Snider,61.37019231,38.62980769,52.94871795,47.05128205,- grammatically correct reviews summarize the following into 3 distinct bullet points,- a great family agency that always seems to put my needs first,- there is rarely a time I can't reach the owner and get personal service.
Armstrong's,61.35025063,38.64974937,57.27548037,42.72451963,"- reviews: ""the food is always amazing no matter what you get"" ""I like to try Italian sausage when I go different places,"" says one reviewer","- ""I got them anyway and they were just fine","- not bad, not great...but fried shrimp"""
1947 Tavern,61.32589286,38.67410714,60.71626984,39.28373016,"- this review is for my neighborhood bourbon bar, not my neighborhood dinner spot",- the bartenders get some heat because they take a while to make a drink,"- if you want to drink bourbon in Pittsburgh, there is only one place to do so."
AA Locksmith,61.29386608,38.70613392,51.31573803,48.68426197,- yelp reviews are grammatically correct and provide clear context,- within 30 minutes they showed up with a smile and took care of the problem in no time,- I love these guys
Acapulco Mexican Restaurant & Bar,61.25411088,38.74588912,46.83638713,53.16361287,- the standard fare (combination platters) are Mexican comfort food served in a friendly manner that makes the meal a delight,"- try the Enchiladas Sizes, Chicken Flats, or most one of the combination plates",- they're all good.
Arriviste Coffee Bar,61.20159484,38.79840516,58.2444649,41.7555351,- reviews: Wonderful place to sit and enjoy a latte or espresso,"- atmosphere is good, not much seating, pricing is fair","- there's one for expresses and lattes, coffee, tea, and the few sweet desserts."
Amarabica,61.15907935,38.84092065,58.13507789,41.86492211,"- ""crazy mock"" is a small homely coffee shop with small town character","- the barista was pleasant, and their menu was easy to read",- the atmosphere is nothing special but interesting with bright paint and large designs.
Anastasia's Crown Esthetic services,61.15056818,38.84943182,60.56818182,39.43181818,- Yvette is so friendly and nice that you instantly feel at ease,"- she is thorough, and the waxing goes by fast since she has music playing","- if you are looking for a clean and hygiene studio, this is a place to choose."
Apex Auto Service,61.14148239,38.85851761,44.29429429,55.70570571,- CNN's Nina dos Santos gave this place five stars,- she used the bathroom three times during her three-and-a-half hour visit,"- dos Santos: ""I am not in the business of revealing to men I don't know what I do in the bathroom"""
Alice's diner,61.13771186,38.86228814,55.59981168,44.40018832,- I was served a broken over easy egg and many people served omelettes that were overdone and consisted of a disc of egg with veggies/meat stuck in the middle,- the glass of water they gave me even had what looked like a film of grease on top.,
Apteka,61.12480575,38.87519425,62.26831502,37.73168498,"- ""Apnea"" isn't a good vegan restaurant",- it's a good restaurant,- there's no meat on the menu
Abruzzi Italian Cucina,61.0538737,38.9461263,57.9985119,42.0014881,- Abruzzo's has quickly become my go-to restaurant in the Irwin area,"- their homemade, warm bread always comes to the table first to get your meal started","- their sangria, both the red and the white, are also a homemade recipe."
Anthony Jr's Restaurant & Pizzeria,60.9988438,39.0011562,58.63067155,41.36932845,- Anthony Jr's is a nice place to sit down with the family for a pizza or pasta dinner,- the breadsticks are good,- the stuffed peppers are GREAT
Angelical Touch Massage,60.99865363,39.00134637,48.15929705,51.84070295,"- ""angelical touch"" is the perfect name for Donna's business","- ""I've had several massages before by several other people and no one has ever beat her techniques"" ""when I am done I feel amazing and extremely relaxed!""",
A Peace of Eden Salon and Spa,60.96799797,39.03200203,49.25402461,50.74597539,- reviewer has been going to a peace of Eden hair salon for 1.5 years,- she has not been dissatisfied with her cut and color,"- the interior is modern, spacious, clean, and a more relaxed feel."
Anchor & Anvil Coffee Bar,60.96216104,39.03783896,53.55813492,46.44186508,"- reviews: ""fantastic coffee, tea, dessert, and sandwich café"" ""a great urban gem off the main road of 65 in a cute river town"" ""the chili was very impressed--mild spicy, hearty, and warming""",,
Aerie,60.91742901,39.08257099,56.26381742,43.73618258,"- reviewer: ""from the viewpoint of a gay male, this store does nothing for me"" ""from the standpoint of a gay male, this store does nothing for me...if you know what I mean"" ""it's just a smaller version of an American Eagle store, except more organized""",,
Allegheny Medical,60.91666667,39.08333333,45.36904762,54.63095238,- Allegheny medical is the LAST place anybody wants to go for any type of visit,- johns utter: they are pathetic and have some of the worst attitudes in the office,"-S utter: if I was dying, and they were the last ""medical"" available to keep me alive, get my coffin ready and hole dug."
Aldo Coffee Co,60.88605967,39.11394033,50.63550852,49.36449148,"- the coffee is average, the people are very friendly, but what really sets the place apart is the quiche that they make fresh daily","- if you have a LOT of time to wait in line while the server tries to do too many things at once, don't get any food.",
Armstrong Auto Sales,60.86529356,39.13470644,47.76515152,52.23484848,- the 2008 Ford Escape is a great car,- it needs a lot of work,- Evan still paying on the fuel line
Asian House,60.85575536,39.14424464,51.64113664,48.35886336,- the green curry is maybe the best Thai curry I've had in the area,- the crab Rangoon and fried dumplings are great appetizers,- the shrimp lo mein is my test dish for any new Asian restaurant.
Aptive,60.8514379,39.1485621,47.56605529,52.43394471,- Sam Brooks did an excellent job! He took time to explain the treatment plan and made sure he met my needs,- Active exceeded what my previous pest-control provider did for a better price! Highly recommend,"- he was very thorough, and did not appear rushed."
Athleta,60.82213763,39.17786237,55.37692193,44.62307807,"- Athlete offers a ""reserve in store"" option where you can select up to five items online",- I am obsessed w their products,"- they wash well, wear well, and super chic"
Animal Nature,60.80418755,39.19581245,48.24119349,51.75880651,"- animal nature is an eco-friendly, human-grade, sustainable, organic and fair-trade pet store",- animal nature is a great place to bring your pet with you,- animal nature is a great place to learn more about the products they carry.
Aaron Varga Photography,60.78579365,39.21420635,58.1784127,41.8215873,"- if you're getting married in the Pittsburgh area, go book Aaron Vargas right now",- he's a magician behind the lens and does things you didn't even know you could do without massive amounts of Photoshop,"- if you want the photos that wow strangers, he'll make it more special."
AT&T,60.75712121,39.24287879,52.33414141,47.66585859,- reviews: a newly remodeled store with all the latest gadgets,- a 4K TV that sucks you into a DTV experience,- employees had no idea what they're doing
Auntie Ann's Pretzels,60.75431034,39.24568966,47.75862069,52.24137931,- Auntie Ann's pretzels taste like Windex smells,- Gross + There aunt many places like this around anymore,- I wish this was a little Amish stand because they really make the best lemonade and pretzels.
Altar Bar,60.74002574,39.25997426,51.58622909,48.41377091,- the view of the stage wasn't the best unless you are standing in the front or have one of the few standing spots along the railing on the 2nd floor,- the security/door people were a bunch of rude kids talking crap about how people were dressed and looked.,
Abay Ethiopian Cuisine,60.73470238,39.26529762,55.00079365,44.99920635,- the vegetarian fare we had was full of flavor and lacked the heavy grease/oil that's often found at other Ethiopian restaurants,"- the interior is intimate but not tiny, and you can sit at normal tables or small wicker tables",- the waitress was very attentive and pleasant as we ate.
1 For the Road,60.70605695,39.29394305,55.40609531,44.59390469,- the store itself is probably not how you would picture a 6 pack store that has a bar and food,- the coolers and shelves of beer are where they shine,- the food that I had at their Christmas party this past year was wonderful.
26th Street Market and Cafe,60.68925866,39.31074134,54.17128878,45.82871122,"- reviewer: ""the inconsistency is borderline schizophrenic & that really bums me out"" ""the chicken & tuna salad are fantastic"" ""the menu variety and quality paired with the prices is nearly unbeatable""",,
Antique Mall Ohio River,60.6750744,39.3249256,55.93035714,44.06964286,- reviews: not bad - a ton of stuff but nothing particularly high end,"- store was messy, dirty and cold - there seemed to be almost no heating",- love this place it is huge
21st Street Coffee And Tea,60.61629605,39.38370395,54.18938766,45.81061234,"- reviewer: service is courteous, but not outgoing; coffee is excellent","- reviewer: ""this is a terrific little place that takes its beverages seriously, but not too"" reviewer: ""this is a terrific little place that takes its beverages seriously, but not too""",
Amberson Apartments,60.58489305,39.41510695,54.80392157,45.19607843,"- the apartments were okay, not great but not bad either, I would say just average for the area",- the cons are that the apartment itself is a little bit old,"- No dishwasher or AC, but you get what you paid for."
Anita-Stitch,60.57392214,39.42607786,57.23938224,42.76061776,"- reviews: unhelpful, unhelpful, unprofessional, unprofessional","- Anita is a complete pro to alter or hem anything, whether it be a dress, pants, or fur coat",- I will definitely be back for more alterations in the future.
A2Z Pest Control,60.57210999,39.42789001,42.93479237,57.06520763,- a2z pest control was recommended to me for a mouse problem,"- the company took down dust and sprayed, and we never had an issue with bees again",- I am HIGHLY ALLERGIC to bees and wasps.
Al's Motor Works & Auto Body,60.55642,39.44358,47.53965531,52.46034469,- reviewer's father has been going to Al's for a while,- flange connecting exhaust to muffler rusted all the way through,- reviewer's dad highly recommends for Al is honest and master mechanic.
Affogato,60.55493638,39.44506362,54.16093474,45.83906526,"- I highly recommend this place, it has a unique charm",- I visited this place for the blue ribbon bacon festival,"- I had the plain coffee, and it was a bit more bitter and weak than anything in Texas."
Aseoma,60.54191468,39.45808532,54.2906746,45.7093254,- Aroma is vegetarian friendly and gladly substituted tofu for chicken in lo mein,"- I absolutely love the tacos, especially the Fire meat and the chicken","- I also tried the pad thai which was delicious, tangy, and filling."
Alioto's,60.51084957,39.48915043,49.94172078,50.05827922,- basic pizza + Allots is less than 2 minutes away from my home,- I'm surprised after reading these reviews to see that some folks don't like their pizza,- I think they serve some of the best pie in town.
A'Pizza Badamo,60.509952,39.490048,50.15739695,49.84260305,-B ado's has been my go-to pizza delivery spot for a few weeks,"- this time, the pizza was a bit underdone, and it took FOREVER to be delivered","- if faced with the choice of Beta's or a Singer furry convention, I'd choose this place."
Angelina's Pizzeria,60.48611111,39.51388889,52.77777778,47.22222222,- reviews: pizza is excellent as are the cigar rolls and delivery is reliable,"- the crust was soft, cheese very greasy and the sauce is as good as Vinny's which is rubbish","- food was late, took over an hour and cold."
Afamia Mediterranean Grille,60.43767601,39.56232399,54.65962622,45.34037378,"- baba famous is roasted eggplant blended with Tahini, garlic, and lemon","- baba famous is roasted eggplant blended with Tahini, garlic, and lemon",- baba famous is roasted eggplant blended with a garlic sauce.
Accents In Ink,60.30092278,39.69907722,58.23654244,41.76345756,- accents in ink is one of the best tattoo studios in the U.S.,- for tats and recoloring an old one,- accents in ink is one of the best tattoo studios in the U.S.
20/20 Opticians,60.26399305,39.73600695,51.67689978,48.32310022,- 20/20 opticians helped me find the ideal frames and created the prescription lenses in house,"- ""I've been in desperate need of contacts and my glasses needed upgraded as well"" 20/20 is one of the best opticians in the area.",
4th Avenue Grille,60.20575923,39.79424077,52.44948713,47.55051287,"- 4th & 0 is a great ""bar food"" joint close to my office",- it's not overwhelmed with too many green pepper or onions,- it's a great place for a quick lunch or dinner.
Abbey Cleaners,60.18533158,39.81466842,47.95213,52.04787,"- a relatively new customer, but each time I have walked in the service is wonderful","- the price is average, but you always get your stuff back in a timely manner",- a dry cleaner with friendly owners located in the shopping center with Giant grocery.
Affordable Fence & Railing,60.13668085,39.86331915,52.82691446,47.17308554,- reviewer had a black chain link fence installed in the dead of winter,- the installer showed up and installed on the day we had scheduled in advance,- he told me that it was a waste of my money and that he could leave.
Achieve A-Nu-Yu,60.11873329,39.88126671,51.43003565,48.56996435,"- ""super paranoid worker outer"" hates to work out and doesn't want anyone to watch","- ""I've been training with Ernie for the past four weeks, and it's the best workouts"" ""if you're looking for a huge corporate gym with all the bells and whistles his won't be the place for you""",
90's Nails,60.10806424,39.89193576,47.63523461,52.36476539,"- reviewer had his first pedicure here, and it was fun to feel a little pampered",- the younger man did my fills most of the time and they were fine,- if you're getting a fill you can't beat the quick wait times.
Armstrong's Express,60.0997463,39.9002537,55.55110144,44.44889856,"- reviews: wings were good, but lacked more Cajun flavor and were a little greasy",- the calzone was outstanding,- Also their ranch is DA BOMB
Anthony's Barber Shop,60.06107391,39.93892609,54.16666667,45.83333333,- reviewer says he's been going to Anthony's barber shop since he was a little kid,- the barbers at Anthony's do it well and clean me up well enough,"- if it's packed with people, you're probably better off going to Sport Clips."
7-Eleven,59.96446078,40.03553922,40.10784314,59.89215686,"- the store itself was fine-had things I needed but this if this were a review for 7 Elevens overall-they really, really, REALLY, suck",- 7-Eleven standard fare made a 4-star affair by being clean and having friendly staff.,
#1 Cochran Hyundai - Monroeville,59.95799706,40.04200294,46.6717584,53.3282416,- Cochran Hyundai's check engine light came on just before a 1000-mile driving trip,"- the cause was determined to be minor, and in fact, had already been corrected",- the service center has me HIGHLY disappointed and here is why.
AnExquisite Massage,59.93163314,40.06836686,57.31527094,42.68472906,"- an Exquisite massage is a small, quaint massage shop","- Tiffany is a wonderful masseuse, powerful when necessary to knead out tough spots and muscle soreness","- if you haven't tried this establishment out, feel free to give her a call."
Alluring Designs Salon,59.88520408,40.11479592,46.19099948,53.80900052,"- reviewer: ""we haven't seen you in a long time","- get $10 off your next service"" reviewer: ""I've had one complimentary manicure in 10 years, and it was during my first or second visit"" ""I would definitely come back when in town for another manicure or to get my hair cut""",
Airy Pines Boarding Kennel,59.86433459,40.13566541,53.63395565,46.36604435,"- I picked up my dog on a Sunday, and her eyes were heavily and severely crusted with mucus and gook","- the owner lied and said it was ""one day"" of gook","- unless we get a refund, we will meet in small claims court."
Ace Lock,59.85741971,40.14258029,57.33111849,42.66888151,"- reviews: excellent business, professional courteous and extremely knowledgeable people",- don't go to Home Depot for key copies which won't even work,- get them here
31st Street Bridge,59.83108108,40.16891892,52.53753754,47.46246246,- the 31st street bridge is one of the great bridges in the Pittsburgh area,"- after a renovation a few years ago, this is still in perfect shape",- a nice wide sidewalk on the downstream side of the bridge offers stunning views of the river and downtown.
Allegheny Landing,59.8015873,40.1984127,54.8015873,45.1984127,"- Allegheny Landing is a beautiful space known for its sculpture court, recreational path, and stunning views of Pittsburgh fixtures",- park nearby and take a walk,"- it's beautiful, it's clean, and it's safe."
Allegheny Ford Isuzu Truck Sales,59.78333333,40.21666667,48.18888889,51.81111111,- cnn.com's report boot camp challenges reporters to think critically about their vehicles,- ireport.com: do you have a vehicle to sell? Send it to CNN report,- ireport.com: do you have a vehicle to sell?
Acri Community Realty,59.77140725,40.22859275,43.56290174,56.43709826,"- reviewer: ""all questions and concerns were addressed in a timely and complete manner"" ""I'm hoping pairing her up with the two new guys (TJ and Eric) on our board, she should soar!"" ""I have had ACRI as property manager where I live for about the past 3 years""",,
10th Street Tattoo and Body Piercing,59.75685104,40.24314896,48.33974954,51.66025046,- I went to 10th street to get a tattoo for my cousin's family reunion,- the shop was open until 2 am and there was a lot of quirky artwork and sketches,- I definitely would go back to took and recommend him to anyone looking to get a tattoo.
